id,name,description,unit_price,merchant_id,created_at,updated_at
223,Item Voluptates Cum,Autem est dolorem optio dolorem rem cum ut. Dolorem aut ab ex. Repudiandae quia quibusdam in voluptatem totam.,15165,13,2012-03-27 14:54:00 UTC,2012-03-27 14:54:00 UTC
224,Item Est Non,Quis saepe quo perspiciatis possimus et commodi. Repellat est sed tempore rem laboriosam ad. Veritatis minima vero quae voluptatem assumenda.,6963,13,2012-03-27 14:54:00 UTC,2012-03-27 14:54:00 UTC
225,Item Et Consequatur,Occaecati excepturi voluptates repudiandae consequatur amet quia. Saepe explicabo libero. Explicabo reiciendis reprehenderit est error et et. Alias illo quae. Maxime sapiente quas.,61980,13,2012-03-27 14:54:00 UTC,2012-03-27 14:54:00 UTC
226,Item Aut Debitis,Velit tenetur corrupti sed repudiandae doloremque quia. Molestiae necessitatibus voluptatem. Quis ex sed nobis. Nisi ut laudantium quibusdam eius.,89958,13,2012-03-27 14:54:00 UTC,2012-03-27 14:54:00 UTC
227,Item Dicta Autem,Fugiat est ut eum impedit vel et. Deleniti quia debitis similique. Sint atque explicabo similique est. Iste fugit quis voluptas. Rerum ut harum sed fugiat eveniet ullam ut.,85319,14,2012-03-27 14:54:00 UTC,2012-03-27 14:54:00 UTC
228,Item Ut Aliquam,Quia libero sed porro. Exercitationem dolor laboriosam vitae est ducimus et. Eveniet nihil cum quis exercitationem sequi quidem. Velit occaecati et officiis dolorem consequuntur ad. Ut soluta debitis deserunt.,65650,15,2012-03-27 14:54:00 UTC,2012-03-27 14:54:00 UTC
229,Item Labore Perspiciatis,Exercitationem id rerum molestiae. Exercitationem nulla vitae quis aliquam. Omnis aut deleniti dicta. Aliquid maiores est perspiciatis quod. Provident rem hic libero.,60971,15,2012-03-27 14:54:00 UTC,2012-03-27 14:54:00 UTC
230,Item Officia Voluptatem,Iusto voluptatem distinctio modi eveniet deserunt. Necessitatibus atque alias nostrum unde. Velit ipsum tempora qui voluptates.,86434,15,2012-03-27 14:54:00 UTC,2012-03-27 14:54:00 UTC
231,Item Et Rerum,Perferendis ipsa alias molestias autem modi. Magni et consequatur. Quas dolorem dicta ut culpa et. Voluptate est sit asperiores perferendis. Quod et consequatur.,84976,15,2012-03-27 14:54:00 UTC,2012-03-27 14:54:00 UTC
232,Item Laborum Velit,Enim rerum aut sunt nemo. Ea et sequi. Laudantium assumenda nihil non in occaecati iure voluptatibus. Incidunt doloribus eum est fugiat tenetur laudantium. Error totam nesciunt doloribus id dolorum sunt.,68458,15,2012-03-27 14:54:00 UTC,2012-03-27 14:54:00 UTC
233,Item Nisi Minus,Iusto nemo voluptas dolore architecto. Voluptatem qui dolorum hic soluta eligendi sunt at. Voluptates quasi quas dolores. Sed veniam voluptatibus ipsa optio.,37534,15,2012-03-27 14:54:00 UTC,2012-03-27 14:54:00 UTC
234,Item Et Ipsam,Repellat quaerat ab. Enim autem quas sapiente ut sed. Dolores vel sint.,87917,15,2012-03-27 14:54:00 UTC,2012-03-27 14:54:00 UTC
235,Item Aut Laudantium,Est voluptatum et esse ab nobis. Soluta numquam expedita ut dolores atque praesentium laudantium. Nobis aut enim voluptas non ipsum praesentium. Aut provident et praesentium nemo numquam.,38488,15,2012-03-27 14:54:00 UTC,2012-03-27 14:54:00 UTC
236,Item Nesciunt Alias,Sit voluptas voluptates consequuntur non inventore mollitia aut. Quae sint asperiores sint nisi. A rerum adipisci sequi. Fugiat ad eligendi vel ex.,74188,15,2012-03-27 14:54:00 UTC,2012-03-27 14:54:00 UTC
237,Item Maiores Nihil,Tempore quidem vel nam distinctio sint in veniam. Harum vel quis saepe libero reprehenderit accusamus voluptatem. Facilis debitis laborum. Provident unde aut sed voluptatem. Architecto quas omnis molestiae saepe officia sit.,36602,15,2012-03-27 14:54:00 UTC,2012-03-27 14:54:00 UTC
238,Item Sunt Molestiae,Odio sunt at molestias quia similique. Sint hic quod consequatur. Natus sint vel velit eius. A molestiae sed vel odio. Modi labore doloribus laboriosam perferendis tenetur.,53201,15,2012-03-27 14:54:00 UTC,2012-03-27 14:54:00 UTC
239,Item Ducimus Et,Assumenda ex sed. Eaque ut et incidunt. Nam voluptates harum ipsa autem consequatur ea. Sed voluptates rerum corporis.,27953,15,2012-03-27 14:54:00 UTC,2012-03-27 14:54:00 UTC
240,Item Magnam Corrupti,Est molestiae optio autem non necessitatibus. Reprehenderit corporis eius. In quam totam. Aut omnis quo velit sunt voluptatum vel voluptates.,96344,15,2012-03-27 14:54:00 UTC,2012-03-27 14:54:00 UTC
241,Item Odit Laboriosam,Laudantium quisquam ullam non aliquid ipsa et. Aut error sed suscipit cupiditate. Distinctio enim consequatur et.,89218,15,2012-03-27 14:54:00 UTC,2012-03-27 14:54:00 UTC
242,Item Recusandae Sequi,Rerum voluptas sit dolorum officia non. Voluptatem debitis commodi modi. Voluptatibus excepturi eos ut sunt. Ipsam harum voluptatem.,64297,15,2012-03-27 14:54:00 UTC,2012-03-27 14:54:00 UTC
243,Item Voluptates Perferendis,Eum magni molestias tempora voluptatem in. Non quia qui explicabo. Voluptatem id atque in repudiandae. Ullam dicta sed fuga.,70181,15,2012-03-27 14:54:00 UTC,2012-03-27 14:54:00 UTC
244,Item Dolorem Quas,Accusantium porro ducimus. Eos reiciendis consequatur. Libero iste officia nemo molestias omnis rem voluptatum. Laboriosam quo quas ea ut deleniti. Mollitia fuga quo maiores qui quia.,97806,15,2012-03-27 14:54:00 UTC,2012-03-27 14:54:00 UTC
245,Item Ratione Nostrum,Id culpa officiis doloremque sapiente nostrum dolores. Cupiditate repellat repellendus ratione non et et. Mollitia velit optio consequatur sunt illum assumenda. Cupiditate cum accusamus sed fugiat et et.,42593,15,2012-03-27 14:54:00 UTC,2012-03-27 14:54:00 UTC
246,Item Cumque Quaerat,Qui non temporibus quidem cumque et rerum. Quidem vero doloribus enim. Illum repudiandae cum autem ea. Repellendus vero fugit. Ut impedit dolores soluta numquam dolore veritatis eaque.,64317,15,2012-03-27 14:54:00 UTC,2012-03-27 14:54:00 UTC
247,Item Voluptates Occaecati,Quae ut reiciendis. Dignissimos aliquam aut minima optio sed quo porro. Voluptatem occaecati dolores qui corrupti velit. Dolores eaque odio vel. Dolorum perferendis modi odit.,555,15,2012-03-27 14:54:00 UTC,2012-03-27 14:54:00 UTC
248,Item Voluptatem Quam,Et quis delectus quia consectetur rerum nulla exercitationem. Repellendus vel et iusto nobis molestiae. Est sed sequi suscipit nihil dignissimos enim.,79241,15,2012-03-27 14:54:00 UTC,2012-03-27 14:54:00 UTC
249,Item Odit Quod,Modi doloribus sunt repellendus architecto est qui repudiandae. Optio labore voluptatum. A totam quisquam tenetur eaque. Repudiandae voluptate qui veniam consequuntur. Accusamus dolores nihil ut minus hic odit deserunt.,86384,15,2012-03-27 14:54:00 UTC,2012-03-27 14:54:00 UTC
250,Item Sint Porro,Molestiae quia sint velit. Dolorem molestiae in ea maiores. Est impedit quia. Nihil illum magni omnis qui. Explicabo tempora vel ullam.,20021,15,2012-03-27 14:54:00 UTC,2012-03-27 14:54:00 UTC
251,Item Corporis Inventore,Vero totam temporibus omnis. Accusamus sed excepturi sit ad magni odit quas. Dolor ad vel iste occaecati. Iste consequatur quidem.,72848,15,2012-03-27 14:54:00 UTC,2012-03-27 14:54:00 UTC
252,Item Ducimus Eaque,Sequi veritatis tempora occaecati vel. A eum et et. Repellendus ratione rem odio iste maxime exercitationem. Nobis officiis commodi. Ipsam est suscipit repudiandae ut nemo laudantium rem.,17186,15,2012-03-27 14:54:00 UTC,2012-03-27 14:54:00 UTC
253,Item Praesentium Consectetur,Commodi dignissimos cupiditate alias sunt quia ut consequatur. Quidem repudiandae ratione quia id. Sunt enim ullam nisi et et voluptatum. Impedit quos est cupiditate nostrum magni.,72793,15,2012-03-27 14:54:00 UTC,2012-03-27 14:54:00 UTC
254,Item Dolor Dolores,Sequi ut doloremque corrupti. Et tenetur omnis sapiente saepe sunt. Ducimus velit illum tempora quasi dolorum nobis. Sapiente inventore sunt.,85267,15,2012-03-27 14:54:00 UTC,2012-03-27 14:54:00 UTC
255,Item Sit Voluptas,Est eius eveniet labore ipsam assumenda aliquam. Inventore consequatur nihil provident soluta quae dolores. Velit eum maxime autem nihil tenetur.,3308,15,2012-03-27 14:54:00 UTC,2012-03-27 14:54:00 UTC
256,Item Officiis Qui,Possimus ut magnam. Eos amet quibusdam sed omnis laudantium incidunt. Deserunt reprehenderit harum similique distinctio rerum est sit.,32256,15,2012-03-27 14:54:00 UTC,2012-03-27 14:54:00 UTC
257,Item Aliquid Voluptate,Nemo aliquid occaecati suscipit qui impedit. Et a voluptas soluta omnis aspernatur qui. A quaerat tempora assumenda. Neque unde nemo minus molestiae nulla ea.,46367,15,2012-03-27 14:54:00 UTC,2012-03-27 14:54:00 UTC
258,Item Aut Consequatur,Et blanditiis sapiente tempora. Iure ut repellat qui distinctio dicta. Velit accusamus facere doloribus eum. Ullam quas sit et quae.,42640,15,2012-03-27 14:54:00 UTC,2012-03-27 14:54:00 UTC
259,Item Necessitatibus Expedita,Non odit repellendus. Dolorem perferendis non qui asperiores quisquam nam dolores. Et exercitationem nam nihil perferendis natus. Quae qui aliquam beatae enim numquam deserunt neque.,43408,16,2012-03-27 14:54:00 UTC,2012-03-27 14:54:00 UTC
260,Item Possimus Qui,Ad eos voluptates perspiciatis esse molestias voluptatem et. Est voluptatibus suscipit aspernatur. Ratione eligendi nostrum labore.,25103,16,2012-03-27 14:54:00 UTC,2012-03-27 14:54:00 UTC
261,Item Et Debitis,Quis provident aut. Fugit accusamus veritatis non. Quod ut ut et quaerat dolores voluptate.,33463,16,2012-03-27 14:54:00 UTC,2012-03-27 14:54:00 UTC
262,Item Omnis Nesciunt,Vero eum adipisci. Ut eius numquam dolorem. Autem ut veritatis. Incidunt sint minima et optio facilis modi. Libero repudiandae amet qui vel nam dolorem error.,38846,16,2012-03-27 14:54:00 UTC,2012-03-27 14:54:00 UTC
263,Item Quidem Laudantium,Magnam sint quasi ipsa quaerat saepe et et. Molestias porro tempore earum non iusto dicta. Debitis ad deleniti molestiae iste. Ea est perferendis et omnis est harum.,13569,16,2012-03-27 14:54:00 UTC,2012-03-27 14:54:00 UTC
264,Item Error Voluptatem,Quaerat doloribus voluptate in et a. Non fugiat recusandae ut provident molestiae. Quae cum pariatur ullam exercitationem consectetur voluptas quo. Maiores eius fugit iure nostrum.,23208,16,2012-03-27 14:54:00 UTC,2012-03-27 14:54:00 UTC
265,Item Illo Facilis,Omnis ullam ut qui temporibus voluptas sed dicta. Pariatur modi sit omnis voluptatum omnis consequatur. Saepe doloremque perspiciatis nihil dicta. Delectus voluptatem est nobis hic illum incidunt accusantium.,35915,16,2012-03-27 14:54:00 UTC,2012-03-27 14:54:00 UTC
266,Item Ut Modi,Eos exercitationem facilis in aliquam. Et velit voluptas corrupti quia omnis dolorem repellendus. Ipsum et dolores fugit est molestiae. Autem minima unde quos voluptas sed ut iure. Laborum sunt debitis provident laboriosam.,12093,16,2012-03-27 14:54:00 UTC,2012-03-27 14:54:00 UTC
267,Item Non Possimus,Est omnis necessitatibus. Quod dolor et quas illum. At dolorum aut odio laudantium. Voluptates similique omnis quis nihil consequuntur. Voluptatum necessitatibus velit quibusdam.,71418,16,2012-03-27 14:54:00 UTC,2012-03-27 14:54:00 UTC
268,Item Quia Nesciunt,Qui ut perspiciatis rem sed ex beatae nobis. Quisquam fuga velit eaque quis. Nobis sunt non laudantium ut et quo. Libero nostrum optio vel dolorem.,43943,16,2012-03-27 14:54:00 UTC,2012-03-27 14:54:00 UTC
269,Item Est Nisi,Ipsam facere ut eum doloremque temporibus. Debitis iusto cumque quis necessitatibus ut. Fuga consequatur natus. Quisquam eius et veniam quaerat aut. Autem et cupiditate hic ut iusto.,70536,16,2012-03-27 14:54:00 UTC,2012-03-27 14:54:00 UTC
270,Item Qui Voluptatibus,Omnis quo corrupti. Nostrum ut et accusamus harum. Sed quasi excepturi quia porro ut doloribus.,6003,16,2012-03-27 14:54:00 UTC,2012-03-27 14:54:00 UTC
271,Item Consequatur Est,Error consectetur fugiat debitis iure. Commodi debitis et eveniet minus voluptatem voluptas. Et nulla in vero et est. Autem sunt architecto. Quam tenetur quia ut consectetur eum et adipisci.,79010,16,2012-03-27 14:54:00 UTC,2012-03-27 14:54:00 UTC
272,Item Sunt Quo,Voluptas consequuntur est et recusandae. Fugit animi ut voluptatem eos unde. Sunt sint ut voluptatem ipsum sapiente nisi quasi. Voluptatem quo perspiciatis.,47882,16,2012-03-27 14:54:00 UTC,2012-03-27 14:54:00 UTC
273,Item Ipsum Necessitatibus,Reprehenderit voluptates debitis ipsam. Expedita quo impedit aut dolores assumenda maiores ea. Consectetur neque at blanditiis. Rerum nesciunt eius numquam aliquam earum quis. Dolorum dolorem fugit provident illum quas dolores magnam.,46617,16,2012-03-27 14:54:00 UTC,2012-03-27 14:54:00 UTC
274,Item Ducimus Architecto,Sed saepe omnis voluptatem nulla omnis. Expedita maiores facere veritatis nemo eius sit. Molestiae quibusdam et perspiciatis iusto. Sunt voluptatibus et impedit facilis necessitatibus illum sed.,16778,16,2012-03-27 14:54:00 UTC,2012-03-27 14:54:00 UTC
275,Item Quae Modi,Cum omnis incidunt veniam consequatur praesentium. Fuga eos distinctio facilis velit. Non ut sint sint tempora molestiae. Impedit perferendis rerum ratione.,73399,16,2012-03-27 14:54:00 UTC,2012-03-27 14:54:00 UTC
276,Item Ut Sed,Accusamus et in. Ut qui aliquid. Qui accusamus vel asperiores officiis. Rem aliquam doloribus repellendus. Qui iure et sed.,2052,16,2012-03-27 14:54:00 UTC,2012-03-27 14:54:00 UTC
277,Item Magnam Inventore,Est praesentium ullam. Corporis harum ea incidunt. Eaque dolor explicabo et deserunt pariatur incidunt. Et architecto et nulla voluptatem.,37996,16,2012-03-27 14:54:00 UTC,2012-03-27 14:54:00 UTC
278,Item Labore Vel,Sed a at ex voluptatem vel dolorem. Aspernatur nostrum dolor a. Provident necessitatibus alias reprehenderit voluptas odit mollitia. Nemo illum eius ratione et non itaque sed. Consequatur et eum pariatur nisi quos.,78243,16,2012-03-27 14:54:00 UTC,2012-03-27 14:54:00 UTC
279,Item Et Maiores,Odit inventore repudiandae at aut eligendi. Ipsa quidem impedit. Nisi doloribus sequi esse. Explicabo alias quia. Quis reiciendis porro eveniet.,36166,16,2012-03-27 14:54:00 UTC,2012-03-27 14:54:00 UTC
280,Item Mollitia Quam,Voluptates autem illum ex eveniet et dignissimos. Expedita fugit perspiciatis adipisci. Quae non quia et qui sit aut facere. Rerum rem porro.,44775,16,2012-03-27 14:54:00 UTC,2012-03-27 14:54:00 UTC
281,Item Placeat Odio,Quia ex illo et iusto maiores velit. Ut repellendus ipsum et. Accusamus veniam voluptates repudiandae tenetur. Molestiae quasi nobis.,30695,17,2012-03-27 14:54:00 UTC,2012-03-27 14:54:00 UTC
282,Item Vel Amet,Qui officiis repudiandae et et optio ut. Quaerat deserunt reprehenderit sit. Dolorem atque doloremque aspernatur. Commodi doloremque repellat officiis. Harum in perspiciatis rerum molestias commodi ipsa aut.,29921,17,2012-03-27 14:54:00 UTC,2012-03-27 14:54:00 UTC
283,Item Aut Id,Enim quod rerum magnam hic consectetur a impedit. Porro quis ut. Ipsam quia corporis.,14797,17,2012-03-27 14:54:00 UTC,2012-03-27 14:54:00 UTC
284,Item Consequatur Enim,Quidem excepturi sint voluptatem sunt. Enim et maxime harum. Quia voluptatibus quia. Veniam necessitatibus non dolores aliquam. Aut non eaque.,14406,17,2012-03-27 14:54:00 UTC,2012-03-27 14:54:00 UTC
285,Item Quis Ea,Accusamus dicta dignissimos quia possimus velit dolor harum. Quia neque explicabo. Amet qui et corporis.,66098,17,2012-03-27 14:54:00 UTC,2012-03-27 14:54:00 UTC
286,Item Occaecati Quis,Quibusdam veniam qui. Voluptatum sit est quas sit. Reprehenderit et vel soluta quo temporibus vero est. Dolore maxime voluptatem doloremque omnis quo.,33554,18,2012-03-27 14:54:00 UTC,2012-03-27 14:54:00 UTC
287,Item Blanditiis Voluptates,Quod rerum iusto. Laboriosam molestiae voluptatum error fugiat perspiciatis incidunt. Iure quaerat laboriosam. A quia ex non perferendis quibusdam.,70456,18,2012-03-27 14:54:00 UTC,2012-03-27 14:54:00 UTC
288,Item Tenetur Voluptatum,Dolor fuga quidem ex sit impedit assumenda excepturi. Iste placeat repudiandae officia sed eum a. Corrupti incidunt et distinctio est porro ut. Magnam facilis ut reprehenderit ab sint repellat. Ullam vitae ut aut sapiente assumenda.,36365,18,2012-03-27 14:54:00 UTC,2012-03-27 14:54:00 UTC
289,Item Eveniet Nihil,Voluptatem quia distinctio. Sapiente quos sit dolores magni. Enim vel dolores totam voluptatem natus. Tenetur nesciunt veritatis eius architecto. Dignissimos accusamus hic delectus mollitia vero ut.,84007,18,2012-03-27 14:54:00 UTC,2012-03-27 14:54:00 UTC
290,Item Rerum Tempore,Inventore vitae qui enim officia totam. In autem quod cumque voluptatibus doloribus temporibus maiores. Ut quidem rem modi eligendi aperiam nulla officia.,40926,18,2012-03-27 14:54:00 UTC,2012-03-27 14:54:00 UTC
291,Item Et Ut,Quia dicta et nihil debitis. Velit consectetur beatae. Nulla sunt eligendi debitis sint molestias vitae. Enim libero nihil delectus aut voluptas.,72369,18,2012-03-27 14:54:00 UTC,2012-03-27 14:54:00 UTC
292,Item Excepturi Dolorem,Dolorem enim qui nulla praesentium illum est. Recusandae qui qui ut doloremque reprehenderit sapiente. Eveniet aut rerum qui. Consequatur provident omnis quae ea id inventore. Tempora quidem eius.,65674,18,2012-03-27 14:54:00 UTC,2012-03-27 14:54:00 UTC
293,Item Magni Eveniet,Aliquam tenetur inventore corporis occaecati perspiciatis. Tempora ea deserunt natus at dolores facilis. Earum vel aut eos rerum ipsum repudiandae quaerat. Quia omnis et distinctio alias aperiam. Quis adipisci dolorum dolorem minima labore dolore.,70038,18,2012-03-27 14:54:00 UTC,2012-03-27 14:54:00 UTC
294,Item In Sapiente,Saepe ipsam qui. Perspiciatis enim voluptas non eligendi quidem earum corporis. Rerum similique debitis et. Est et voluptate magnam neque at quidem sint.,83432,18,2012-03-27 14:54:00 UTC,2012-03-27 14:54:00 UTC
295,Item Ipsum Ut,Maxime deleniti et odio dolor. Nobis mollitia quis impedit. Totam molestiae ut occaecati aliquid. Iste velit voluptate officia temporibus consequatur aperiam.,22438,18,2012-03-27 14:54:00 UTC,2012-03-27 14:54:00 UTC
296,Item Accusamus Commodi,Quisquam ullam sit. Non autem veritatis nostrum assumenda atque. In saepe exercitationem quia. Quidem delectus nobis voluptate sunt. Odit impedit id itaque quis beatae.,53249,18,2012-03-27 14:54:00 UTC,2012-03-27 14:54:00 UTC
297,Item Eaque Ad,Velit temporibus in non autem non nam ut. Qui ipsam id nemo et accusantium cumque. Est labore ut perspiciatis quo.,68842,18,2012-03-27 14:54:00 UTC,2012-03-27 14:54:00 UTC
298,Item Inventore At,Alias ea quibusdam itaque cumque veritatis. Excepturi ut qui optio vero atque. Dolorum cumque tempora culpa et veniam consequuntur est.,9898,18,2012-03-27 14:54:00 UTC,2012-03-27 14:54:00 UTC
299,Item Doloribus Blanditiis,Commodi vero quasi nulla. Commodi facilis molestiae id sunt numquam hic explicabo. Ex quasi dolore ut mollitia ea fuga.,6912,18,2012-03-27 14:54:00 UTC,2012-03-27 14:54:00 UTC
300,Item Illum Et,Voluptates explicabo placeat dolor. Quo accusantium alias et quia eveniet quisquam. Et cupiditate eos ut quis exercitationem. Non et ratione alias temporibus.,59976,18,2012-03-27 14:54:00 UTC,2012-03-27 14:54:00 UTC

