id,name,description,unit_price,merchant_id,created_at,updated_at
1,Item Qui Esse,Nihil autem sit odio inventore deleniti. Est laudantium ratione distinctio laborum. Minus voluptatem nesciunt assumenda dicta voluptatum porro.,75107,1,2012-03-27 14:53:59 UTC,2012-03-27 14:53:59 UTC
2,Item Autem Minima,Cumque consequuntur ad. Fuga tenetur illo molestias enim aut iste. Provident quo hic aut. Aut quidem voluptates dolores. Dolorem quae ab alias tempora.,67076,1,2012-03-27 14:53:59 UTC,2012-03-27 14:53:59 UTC
3,Item Ea Voluptatum,Sunt officia eum qui molestiae. Nesciunt quidem cupiditate reiciendis est commodi non. Atque eveniet sed. Illum excepturi praesentium reiciendis voluptatibus eveniet odit perspiciatis. Odio optio nisi rerum nihil ut.,32301,1,2012-03-27 14:53:59 UTC,2012-03-27 14:53:59 UTC
4,Item Nemo Facere,Sunt eum id eius magni consequuntur delectus veritatis. Quisquam laborum illo ut ab. Ducimus in est id voluptas autem.,4291,1,2012-03-27 14:53:59 UTC,2012-03-27 14:53:59 UTC
5,Item Expedita Aliquam,Voluptate aut labore qui illum tempore eius. Corrupti cum et rerum. Enim illum labore voluptatem dicta consequatur. Consequatur sunt consequuntur ut officiis.,68723,1,2012-03-27 14:53:59 UTC,2012-03-27 14:53:59 UTC
6,Item Provident At,Numquam officiis reprehenderit eum ratione neque tenetur. Officia aut repudiandae eum at ipsum doloribus. Iure minus itaque similique. Ratione dicta alias asperiores minima ducimus nesciunt at.,15925,1,2012-03-27 14:53:59 UTC,2012-03-27 14:53:59 UTC
7,Item Expedita Fuga,Fuga assumenda occaecati hic dolorem tenetur dolores nisi. Est tenetur adipisci voluptatem vel. Culpa adipisci consequatur illo. Necessitatibus quis quo velit sed repellendus ut amet.,31163,1,2012-03-27 14:53:59 UTC,2012-03-27 14:53:59 UTC
8,Item Est Consequuntur,Reprehenderit est officiis cupiditate quia eos. Voluptatem illum reprehenderit quo vel eligendi. Et eum omnis id ut aliquid veniam.,34355,1,2012-03-27 14:53:59 UTC,2012-03-27 14:53:59 UTC
9,Item Quo Magnam,Culpa deleniti adipisci voluptates aut. Sed eum quisquam nisi. Voluptatem est rerum est qui id reprehenderit. Molestiae laudantium non velit alias. Ipsa consequatur modi quibusdam.,22582,1,2012-03-27 14:53:59 UTC,2012-03-27 14:53:59 UTC
10,Item Quidem Suscipit,Reiciendis sed aperiam culpa animi laudantium. Eligendi veritatis sint dolorem asperiores. Earum alias illum eos non rerum.,34018,1,2012-03-27 14:53:59 UTC,2012-03-27 14:53:59 UTC
11,Item Rerum Magni,Iusto ratione illum. Adipisci est perspiciatis temporibus. Ducimus id dolorem voluptas eligendi repellat iure sit.,13046,1,2012-03-27 14:53:59 UTC,2012-03-27 14:53:59 UTC
12,Item Et Cumque,Ducimus id perferendis. Libero ullam odit aut quisquam non. Rem eaque distinctio quos. Eaque nihil odit.,39515,1,2012-03-27 14:53:59 UTC,2012-03-27 14:53:59 UTC
13,Item Voluptatem Sint,Nostrum doloribus quia. Expedita vitae beatae cumque. Aut ut illo aut eum.,59454,1,2012-03-27 14:53:59 UTC,2012-03-27 14:53:59 UTC
14,Item Itaque Consequatur,Voluptatibus omnis quo recusandae distinctio voluptatem quibusdam et. Voluptas odio accusamus delectus sunt quia. Non atque rerum vitae officia odit. Magnam iste occaecati in nihil autem saepe.,39891,1,2012-03-27 14:53:59 UTC,2012-03-27 14:53:59 UTC
15,Item Rerum Est,Nemo voluptatem facere aut quo. Consequatur vel voluptas et. Consequuntur quibusdam ea consectetur accusamus sit optio qui.,42629,1,2012-03-27 14:53:59 UTC,2012-03-27 14:53:59 UTC
16,Item Adipisci Sint,Iure cumque laborum hic autem quidem voluptas. Quis eum adipisci neque magnam. Commodi molestiae exercitationem.,22951,2,2012-03-27 14:53:59 UTC,2012-03-27 14:53:59 UTC
17,Item Laudantium Ex,In dolor architecto doloribus omnis fuga. Dolor minima voluptatem libero voluptatem cum magni ipsam. Et est minus quis doloremque. Praesentium voluptatem dicta eos.,60713,2,2012-03-27 14:53:59 UTC,2012-03-27 14:53:59 UTC
18,Item Reiciendis Est,Velit deleniti facilis quo autem. Eaque unde culpa quis officiis aliquam adipisci porro. Facere sequi in ut vitae. Error alias quae et soluta.,36460,2,2012-03-27 14:53:59 UTC,2012-03-27 14:53:59 UTC
19,Item Rerum Saepe,Fugit et officiis. Qui quia quia omnis. Praesentium est repellendus quaerat id magnam voluptas.,3409,2,2012-03-27 14:53:59 UTC,2012-03-27 14:53:59 UTC
20,Item Dolorem Et,Atque voluptatibus molestiae porro. Possimus facere quam dolor voluptate officia soluta. Ipsam dolores tempore ut.,69338,2,2012-03-27 14:53:59 UTC,2012-03-27 14:53:59 UTC
21,Item Repellendus Harum,Minus sit dolorum velit ratione. Et dolore accusantium quam perferendis repudiandae doloremque saepe. Velit illo doloremque.,63665,2,2012-03-27 14:53:59 UTC,2012-03-27 14:53:59 UTC
22,Item Iure Consequatur,Sint et deserunt. Dignissimos cupiditate officiis hic. Dignissimos tempora non laudantium. Non eligendi dolore recusandae fugit sint. Deleniti id corrupti libero ullam suscipit dolorem.,45736,2,2012-03-27 14:53:59 UTC,2012-03-27 14:53:59 UTC
23,Item Assumenda Animi,Repellendus fuga deleniti dolorum voluptatum perspiciatis. Provident harum laudantium voluptatem consequatur quisquam. Qui non odio sunt quia incidunt vel suscipit. Hic repellendus veniam.,54074,2,2012-03-27 14:53:59 UTC,2012-03-27 14:53:59 UTC
24,Item Rerum Ab,Aut error fuga nihil. Eligendi non aut ipsa. Vel quo ad. In aliquid aperiam consequatur. Ut neque consequatur quia.,20137,2,2012-03-27 14:53:59 UTC,2012-03-27 14:53:59 UTC
25,Item Non In,Error sit qui assumenda. Eius qui nostrum ducimus aut. Expedita et exercitationem deserunt quia aut voluptatem.,61898,2,2012-03-27 14:53:59 UTC,2012-03-27 14:53:59 UTC
26,Item Non Deserunt,Est exercitationem enim quisquam odio qui. Impedit sunt id et expedita eligendi assumenda. Voluptas accusamus omnis pariatur autem numquam non.,16153,2,2012-03-27 14:53:59 UTC,2012-03-27 14:53:59 UTC
27,Item Ullam Temporibus,Aut adipisci deserunt fuga. Expedita ut et atque nemo voluptatem quasi. Voluptas veritatis voluptate et molestiae quaerat ut dolore. Minus aut et aliquid quisquam voluptas. Quos ut cumque illo id et neque fugit.,90131,2,2012-03-27 14:53:59 UTC,2012-03-27 14:53:59 UTC
28,Item Quos Dolorum,Non rerum quas ullam magni. Porro nemo similique veritatis. Voluptatem recusandae quis minus.,15285,2,2012-03-27 14:53:59 UTC,2012-03-27 14:53:59 UTC
29,Item Dolor Odio,Quia error ut odit velit voluptatem vel. Ut quisquam aut porro. Magnam cum rem et quia error voluptatum. Consequatur ipsam aliquid impedit dolorem quasi similique. Exercitationem numquam et.,45184,2,2012-03-27 14:53:59 UTC,2012-03-27 14:53:59 UTC
30,Item Eos Quia,Nostrum ut sed at eligendi facilis commodi. Aspernatur ut facilis et eveniet. Quidem explicabo sunt id non rerum eum temporibus. Eius repellat architecto eos quia iure sapiente consequatur. Omnis vitae consequatur voluptatem illo repellendus.,62584,2,2012-03-27 14:53:59 UTC,2012-03-27 14:53:59 UTC
31,Item Voluptate Ducimus,Commodi et quis est maxime. Enim aut qui mollitia. Nostrum voluptas debitis dolorem sit cum aut. Saepe sit ratione voluptatum nemo incidunt odit cumque.,1171,2,2012-03-27 14:53:59 UTC,2012-03-27 14:53:59 UTC
32,Item Illum Distinctio,Dolorum saepe ut architecto sunt quaerat pariatur. In voluptatem modi et fugit autem. Eius occaecati consequatur et consectetur sed. Nostrum rerum eos natus voluptas quasi ut.,8887,2,2012-03-27 14:53:59 UTC,2012-03-27 14:53:59 UTC
33,Item Corrupti Ut,Sunt ipsam rerum esse assumenda laboriosam et. Corrupti quo exercitationem a distinctio. Magni fuga sit. Numquam placeat accusantium voluptatibus rerum ratione. Qui sed voluptatem non non eius.,23868,2,2012-03-27 14:53:59 UTC,2012-03-27 14:53:59 UTC
34,Item Minus Voluptatem,Et perspiciatis ut optio. Cumque sed necessitatibus quidem ipsam est laborum rerum. Occaecati magnam numquam.,36730,2,2012-03-27 14:53:59 UTC,2012-03-27 14:53:59 UTC
35,Item Aut Sint,Voluptas unde praesentium aut sed aut est qui. Illo velit in nihil nobis. Aut eos quia perspiciatis incidunt id quod velit. Et esse dolore doloribus. Qui omnis reprehenderit sint sit cum.,73887,2,2012-03-27 14:53:59 UTC,2012-03-27 14:53:59 UTC
36,Item Omnis Molestiae,Beatae ratione voluptatem rem cumque voluptas consequatur et. In aliquid rerum aliquam est tempore quas. Consequatur deleniti perspiciatis totam illo enim maxime non. Ea et perspiciatis autem ex et tenetur ullam. Aut nam ut ab nostrum.,9318,2,2012-03-27 14:53:59 UTC,2012-03-27 14:53:59 UTC
37,Item Quis Non,Eum tenetur qui quis corrupti nihil animi. In dolorem quis quia. Et voluptas soluta occaecati qui sint expedita. Enim nesciunt dignissimos est nostrum.,10781,2,2012-03-27 14:53:59 UTC,2012-03-27 14:53:59 UTC
38,Item Facere Eveniet,Temporibus aut quia voluptas. Et sunt aut et eum temporibus. Reiciendis quis dignissimos. Velit quisquam perferendis. Eum autem dolorum possimus odit minus officiis.,10605,2,2012-03-27 14:53:59 UTC,2012-03-27 14:53:59 UTC
39,Item Saepe Id,Neque necessitatibus eos est itaque sint ea consequatur. Aut eaque fugit doloremque ducimus. Facere et fugiat. Ut labore quo eos dolores. Dicta rerum occaecati autem.,77359,2,2012-03-27 14:53:59 UTC,2012-03-27 14:53:59 UTC
40,Item Ut Dolores,Et cum quia esse. Nisi aut id in qui. Consequatur eius quas dicta est dolor reiciendis. Quos qui fuga magni quod.,13853,2,2012-03-27 14:53:59 UTC,2012-03-27 14:53:59 UTC
41,Item Consequatur Eius,Temporibus laboriosam suscipit a iusto. Molestias omnis aut dolores debitis amet. Similique et eligendi ut. Maiores sed et at minus commodi dignissimos soluta.,57689,2,2012-03-27 14:53:59 UTC,2012-03-27 14:53:59 UTC
42,Item Sapiente Sed,Eum et vel quam reprehenderit soluta quod voluptates. Maxime expedita voluptatibus. Dicta molestias architecto officia sit. Sed tempora et ducimus totam saepe earum eos.,60558,2,2012-03-27 14:53:59 UTC,2012-03-27 14:53:59 UTC
43,Item Quisquam Voluptatum,A sed et. Rem eligendi sint voluptatem ratione quia consequatur natus. Est nulla tempora et odio aut totam pariatur. Tenetur sed voluptatem ipsum.,45150,2,2012-03-27 14:53:59 UTC,2012-03-27 14:53:59 UTC
44,Item Sequi Minima,Corrupti facilis ut nisi vel provident quia. Aut dignissimos enim molestiae. Laudantium in autem est. Ipsa adipisci magni quam.,64814,2,2012-03-27 14:53:59 UTC,2012-03-27 14:53:59 UTC
45,Item Id Aut,Blanditiis alias cupiditate dolores. Cum architecto est magnam similique quis culpa est. Incidunt consequatur sunt maxime veritatis labore officia. Quaerat nemo molestias et omnis quia.,31876,2,2012-03-27 14:53:59 UTC,2012-03-27 14:53:59 UTC
46,Item Excepturi Et,Occaecati excepturi quisquam. Eligendi dolore dolorem officiis est aut. Alias omnis aspernatur id et qui. Rerum voluptates vitae illo velit cumque odit id. Quos omnis eum.,39226,2,2012-03-27 14:53:59 UTC,2012-03-27 14:53:59 UTC
47,Item Et Deleniti,Eaque laboriosam iste possimus. Ut nihil est labore. Ut sit eos saepe quis aut magnam. Aut quia ut officiis voluptate sint. Voluptatem cumque distinctio aut ipsum et commodi.,84787,2,2012-03-27 14:53:59 UTC,2012-03-27 14:53:59 UTC
48,Item Aut Sunt,Nulla delectus culpa ut quo provident nostrum. Cupiditate molestiae qui voluptatem repellat eum ut ut. Nisi aliquam adipisci.,75985,2,2012-03-27 14:53:59 UTC,2012-03-27 14:53:59 UTC
49,Item Saepe Nihil,Ea consectetur omnis quia aliquam et quasi. Incidunt rerum autem sint est ratione. Est illum reiciendis. Soluta rem minima et similique et.,41537,2,2012-03-27 14:53:59 UTC,2012-03-27 14:53:59 UTC
50,Item Facere Ex,Et est cum ipsam occaecati quidem aspernatur. Inventore quae recusandae. Molestiae nemo quis asperiores nobis. Corrupti quaerat est. Id consequatur possimus dolorem qui.,89333,2,2012-03-27 14:53:59 UTC,2012-03-27 14:53:59 UTC
51,Item Optio Magnam,Non cum provident cumque a dolores voluptates iste. Qui distinctio hic. Officia consequatur et.,26252,2,2012-03-27 14:53:59 UTC,2012-03-27 14:53:59 UTC
52,Item Sit Facere,Vero libero laboriosam qui expedita dignissimos. Deserunt aliquam et aut accusamus aut iure natus. Qui eveniet quidem. Et praesentium quos doloremque quidem aut ab. Eius doloribus aut nisi.,85642,2,2012-03-27 14:53:59 UTC,2012-03-27 14:53:59 UTC
53,Item Sunt Nesciunt,Magni eos cupiditate animi. Ea consequatur saepe quo earum. In magni dolorem maxime tempora. Inventore iure ad delectus quo neque voluptates. Optio repellat occaecati.,71198,2,2012-03-27 14:53:59 UTC,2012-03-27 14:53:59 UTC
54,Item Enim Error,Odio inventore quis quia nesciunt. Libero id ipsam et. Perspiciatis porro vero quia aut aperiam. Quaerat rerum et sit earum ut tempore illum.,77596,3,2012-03-27 14:53:59 UTC,2012-03-27 14:53:59 UTC
55,Item Delectus Dolorem,Et et odit sunt maxime facilis. Tenetur incidunt hic molestiae sequi tempore. Officia repellendus sit in tempore. Sit quam voluptatum qui. Labore voluptate ut perferendis suscipit ut rerum veritatis.,74550,3,2012-03-27 14:53:59 UTC,2012-03-27 14:53:59 UTC
56,Item Iusto Atque,Voluptas repellat voluptas similique incidunt optio quibusdam. Sint quos cupiditate illo. Voluptates dolores est recusandae ex laborum est quasi. Voluptates voluptatem quis deleniti. Velit laboriosam ea.,53898,3,2012-03-27 14:53:59 UTC,2012-03-27 14:53:59 UTC
57,Item Et Reiciendis,In qui eveniet itaque et et vel. Iusto sunt facere ex et enim porro expedita. At dolore ab perferendis ex. Dolor debitis illum nulla.,41548,3,2012-03-27 14:53:59 UTC,2012-03-27 14:53:59 UTC
58,Item Aperiam Voluptatibus,Quasi pariatur et dolor expedita assumenda animi. Voluptas natus numquam. Sint culpa odio. Velit ut aspernatur.,64688,3,2012-03-27 14:53:59 UTC,2012-03-27 14:53:59 UTC
59,Item Consequatur Eum,Qui quibusdam eos. Itaque recusandae impedit consequatur commodi inventore et. Et voluptates quia non omnis commodi adipisci. Quasi praesentium id quibusdam nesciunt. Et nobis qui reprehenderit.,45080,3,2012-03-27 14:53:59 UTC,2012-03-27 14:53:59 UTC
60,Item Accusantium Assumenda,Delectus et quia. Quia praesentium officia recusandae temporibus. Porro suscipit perferendis enim quo.,83380,3,2012-03-27 14:53:59 UTC,2012-03-27 14:53:59 UTC
61,Item Quas Maiores,Porro sapiente corporis deleniti accusamus autem animi. Sunt molestiae sit hic illo. Molestiae eum est voluptas nostrum corporis illum natus.,26172,3,2012-03-27 14:53:59 UTC,2012-03-27 14:53:59 UTC
62,Item Harum Molestiae,Fuga modi eos iusto nisi vero omnis. Blanditiis corrupti quibusdam deleniti qui. Quasi qui maiores tenetur omnis odit incidunt. Omnis ut tenetur. Expedita iure maxime.,60945,3,2012-03-27 14:53:59 UTC,2012-03-27 14:53:59 UTC
63,Item Unde Id,Voluptatum iste ad rem placeat iusto nulla. Qui dolore nostrum non amet illo voluptatem ut. Sunt mollitia id quis quas modi. Vero non corporis soluta eveniet voluptatem.,54001,3,2012-03-27 14:53:59 UTC,2012-03-27 14:53:59 UTC
64,Item Voluptates Qui,Nobis quasi excepturi id dignissimos necessitatibus ad vitae. Eligendi quis facere reiciendis blanditiis adipisci corporis. Nisi commodi sit dignissimos quo nulla nam. Officiis ut accusamus necessitatibus fugit delectus nesciunt repellat. Eum sunt optio nihil laborum incidunt vel magnam.,16497,3,2012-03-27 14:53:59 UTC,2012-03-27 14:53:59 UTC
65,Item Aut Dolorem,Quod exercitationem repellat mollitia possimus rerum. Hic aliquid et eum expedita. Eligendi illum earum vero ut voluptatum at ipsum. Dolorum amet aut enim dolores.,96377,3,2012-03-27 14:53:59 UTC,2012-03-27 14:53:59 UTC
66,Item Fuga Earum,Consequuntur alias voluptatem voluptatem quis odio quia accusamus. Repellat tempora quia sint. Voluptates officia omnis omnis sint sapiente et cum. Aut accusantium modi delectus earum. Sunt animi ad sint.,40482,3,2012-03-27 14:53:59 UTC,2012-03-27 14:53:59 UTC
67,Item Est Tempore,Sit et eveniet est dolor soluta nihil consequatur. Voluptatem modi sapiente nam. Esse sunt cumque ea aut aut consequatur quia.,13649,3,2012-03-27 14:53:59 UTC,2012-03-27 14:53:59 UTC
68,Item Ducimus Error,Recusandae unde quidem delectus error sit. Id delectus voluptas. Nemo mollitia voluptatibus cumque cupiditate voluptatem. Iure reprehenderit deleniti voluptatum et necessitatibus. Voluptas ducimus nisi laboriosam.,33385,3,2012-03-27 14:53:59 UTC,2012-03-27 14:53:59 UTC
69,Item Voluptas Provident,Eum vero laudantium reiciendis. Et neque aut ut. Et iusto sunt inventore omnis possimus. Dolorem voluptatibus error debitis sit sunt consequatur. Officiis fuga at ab ullam quia numquam eum.,56089,3,2012-03-27 14:53:59 UTC,2012-03-27 14:53:59 UTC
70,Item Dolor Dolores,Inventore adipisci sapiente. Doloremque nisi exercitationem. Eum optio quibusdam cumque esse velit rerum. Vel eaque vero. Voluptatum deserunt est.,3797,3,2012-03-27 14:53:59 UTC,2012-03-27 14:53:59 UTC
71,Item Earum Asperiores,Velit amet et iusto aperiam autem. Ullam numquam officia molestiae consequatur. Modi rem odit laudantium unde et suscipit. Unde non aut libero omnis voluptatem.,2896,3,2012-03-27 14:53:59 UTC,2012-03-27 14:53:59 UTC
72,Item Assumenda Impedit,Voluptatem perspiciatis at inventore. Id eius tempore exercitationem cupiditate odit quia. Natus perspiciatis inventore dicta. Praesentium perferendis voluptatum expedita ipsa sit. Excepturi aperiam doloremque explicabo dolor et ab.,91810,3,2012-03-27 14:53:59 UTC,2012-03-27 14:53:59 UTC
73,Item Aut Placeat,Perferendis sed perspiciatis similique rerum corporis. Repudiandae perspiciatis explicabo. Quos recusandae quas perferendis. Est commodi ducimus perferendis voluptatem aut expedita quo.,40005,3,2012-03-27 14:53:59 UTC,2012-03-27 14:53:59 UTC
74,Item Occaecati Non,Numquam repudiandae id commodi voluptatibus deleniti exercitationem. Et quo eos esse aspernatur sapiente dolorem dicta. Quia qui dolorum rem soluta. Dolores culpa vel et voluptate. Repellendus in nemo quo ea autem nulla exercitationem.,92382,3,2012-03-27 14:53:59 UTC,2012-03-27 14:53:59 UTC
75,Item Autem Eligendi,Aliquam dolores dolore voluptas nesciunt non praesentium. Eum nihil repellendus modi. Aut in expedita nesciunt. Ut aliquam dicta omnis voluptas.,29949,3,2012-03-27 14:53:59 UTC,2012-03-27 14:53:59 UTC
76,Item Voluptas Voluptatem,Dignissimos sunt magnam qui eos velit aliquam et. Atque sit rerum consequatur. Hic alias tenetur iusto fugit non. Natus dicta quis porro. Laudantium possimus quasi vel autem qui sunt.,74183,3,2012-03-27 14:53:59 UTC,2012-03-27 14:53:59 UTC
77,Item Numquam Omnis,Quia blanditiis voluptas officia eligendi voluptates ut. Vel inventore eos. Voluptas est asperiores aut vitae tempore.,64804,3,2012-03-27 14:53:59 UTC,2012-03-27 14:53:59 UTC
78,Item Repellendus Quasi,Est suscipit aut et error ab perferendis. Cum officiis quia libero eaque aut dolorum. Sapiente et et quod autem dolor et quis.,4795,3,2012-03-27 14:53:59 UTC,2012-03-27 14:53:59 UTC
79,Item Ut Iusto,Vel veniam quia. Et nemo eum expedita sit. Aut id ut est necessitatibus magnam.,36823,3,2012-03-27 14:53:59 UTC,2012-03-27 14:53:59 UTC
80,Item In Sed,Voluptas aliquid dolores deserunt dolor ipsa. Illum eum aspernatur et. Sit repellendus neque dolor. Qui natus omnis dicta occaecati placeat. Odio ipsam nisi cupiditate nihil exercitationem qui labore.,54808,4,2012-03-27 14:53:59 UTC,2012-03-27 14:53:59 UTC
81,Item Neque Aliquam,Laudantium non rerum rerum consequuntur. Facilis voluptatem quia ducimus. Distinctio assumenda voluptas dolores quod inventore. Delectus voluptatem in impedit voluptatem quos.,13774,4,2012-03-27 14:53:59 UTC,2012-03-27 14:53:59 UTC
82,Item Dolores Error,Dolorum facere consequatur molestias voluptas id autem. Quisquam assumenda molestias reiciendis natus dolorem maiores quod. Vel minima eos et aspernatur.,58542,4,2012-03-27 14:53:59 UTC,2012-03-27 14:53:59 UTC
83,Item Blanditiis Eum,Quos et consequatur nam illo eaque. Et necessitatibus et. Veritatis quo doloribus.,61009,4,2012-03-27 14:53:59 UTC,2012-03-27 14:53:59 UTC
84,Item Hic Soluta,Quam enim sequi. Distinctio quod earum ut deleniti assumenda sed. Id est et accusamus aut.,88026,4,2012-03-27 14:53:59 UTC,2012-03-27 14:53:59 UTC
85,Item Voluptatem A,Vitae molestias ea neque ipsum. Sit aliquid magnam impedit. Aut temporibus quod modi corrupti velit exercitationem natus. A sed nemo maxime nisi. Quos molestias ut ut.,6853,4,2012-03-27 14:53:59 UTC,2012-03-27 14:53:59 UTC
86,Item Incidunt Porro,At in enim vitae. Aut quam dolorum. Maiores aut reiciendis dignissimos incidunt. At voluptatem velit voluptas tempore quidem esse vel. Officiis corporis ipsa vel et quos ut.,48928,4,2012-03-27 14:53:59 UTC,2012-03-27 14:53:59 UTC
87,Item Ut Quo,Qui facilis est voluptatum perspiciatis. Numquam perferendis modi. Error sint et totam officiis accusamus.,38836,4,2012-03-27 14:53:59 UTC,2012-03-27 14:53:59 UTC
88,Item Quaerat Voluptatem,Debitis odit in minus earum. Nisi eum quia. Velit maxime et. Aliquam iusto fugit pariatur nam maxime. Praesentium dignissimos distinctio et ut voluptatem aliquam.,31976,4,2012-03-27 14:53:59 UTC,2012-03-27 14:53:59 UTC
89,Item Nobis Repudiandae,Voluptas qui sit odio. Molestias eos inventore. Natus optio quasi aut. In assumenda in vel incidunt.,62500,4,2012-03-27 14:53:59 UTC,2012-03-27 14:53:59 UTC
90,Item Et Dolorem,Vel provident et ipsam delectus explicabo earum. Magni totam consequuntur ex dolores odio voluptatibus. Quibusdam reiciendis debitis aperiam. Tempora ipsa nostrum. Modi ut aliquam.,15838,4,2012-03-27 14:53:59 UTC,2012-03-27 14:53:59 UTC
91,Item Voluptate Quo,Sapiente dolorem numquam perspiciatis eaque placeat. Architecto ut deserunt maiores. Saepe neque sunt quis cupiditate provident non ut. Beatae velit dolor dignissimos id placeat voluptatibus.,58637,4,2012-03-27 14:53:59 UTC,2012-03-27 14:53:59 UTC
92,Item Corporis Modi,Quidem minus temporibus ullam. Qui placeat rerum molestiae reiciendis nemo in voluptatibus. Cum quisquam sed voluptas adipisci minus non animi. Quod quaerat incidunt. Ipsam corporis laudantium aut unde consequuntur dolores iure.,75043,5,2012-03-27 14:53:59 UTC,2012-03-27 14:53:59 UTC
93,Item Sunt Sed,Veniam voluptate sequi. Quam voluptas voluptates saepe impedit deserunt optio est. Vitae voluptatem doloribus eligendi sit. Quod voluptatum aliquam earum.,96915,5,2012-03-27 14:53:59 UTC,2012-03-27 14:53:59 UTC
94,Item Fuga Eum,Iure et quis illum quia est architecto quia. Nesciunt numquam et mollitia eaque. Dignissimos aliquam aut rerum natus perferendis.,85239,5,2012-03-27 14:53:59 UTC,2012-03-27 14:53:59 UTC
95,Item Alias Cum,Ipsa beatae ut aliquam ut distinctio consequuntur. Voluptas dolorum atque. Reprehenderit quibusdam minima deleniti consequatur.,61358,5,2012-03-27 14:53:59 UTC,2012-03-27 14:53:59 UTC
96,Item Totam Qui,Repellendus voluptate quo facere. Asperiores exercitationem labore rerum ratione sit sunt quam. Porro reiciendis qui ea nobis sapiente. Eos consequatur consequatur nihil. Officia nesciunt esse doloremque alias ea.,25737,5,2012-03-27 14:53:59 UTC,2012-03-27 14:53:59 UTC
97,Item Recusandae Voluptas,Debitis labore culpa ut maiores sunt et. Praesentium ut qui. Eos dolorem odio rerum aut delectus.,28455,5,2012-03-27 14:53:59 UTC,2012-03-27 14:53:59 UTC
98,Item Velit Ea,Consequatur molestiae et occaecati qui veritatis velit. Est asperiores officiis dolores. Quasi similique rem numquam ea repudiandae eaque. Dolor veniam occaecati voluptatum.,11571,5,2012-03-27 14:53:59 UTC,2012-03-27 14:53:59 UTC
99,Item Inventore Omnis,Consectetur ut deleniti. Optio iusto architecto laborum et. Id ratione aut qui optio atque.,39058,5,2012-03-27 14:53:59 UTC,2012-03-27 14:53:59 UTC
100,Item Soluta Libero,Aut quod dolores minima quia doloremque porro cupiditate. Laboriosam doloribus adipisci illum qui. Aliquam quod maiores.,58238,5,2012-03-27 14:53:59 UTC,2012-03-27 14:53:59 UTC
101,Item Quisquam Dolorem,Sunt deserunt omnis dignissimos. Eaque non earum possimus. Ut aut reiciendis possimus architecto. Cupiditate at consequatur quod. Deserunt eligendi quisquam sequi et sit.,25616,5,2012-03-27 14:53:59 UTC,2012-03-27 14:53:59 UTC
102,Item Porro Voluptatem,Necessitatibus veritatis tenetur illo ab. Culpa beatae vel praesentium qui sit id. Aut quia accusamus veritatis sint. Ipsam facere nemo non. Soluta alias voluptatum.,75990,5,2012-03-27 14:53:59 UTC,2012-03-27 14:53:59 UTC
103,Item Quidem Exercitationem,Laboriosam officia placeat. Est placeat odio porro. Sit saepe rerum. Et dolor distinctio id nisi.,23940,6,2012-03-27 14:53:59 UTC,2012-03-27 14:53:59 UTC
104,Item Et Sequi,Quam beatae praesentium vel. Asperiores labore sunt. Sequi voluptatem dolore. Voluptatem rerum aspernatur recusandae cum molestiae error. Autem id modi ut accusantium maiores assumenda amet.,1061,6,2012-03-27 14:53:59 UTC,2012-03-27 14:53:59 UTC
105,Item Laboriosam Vel,Vel id molestiae. Eos quam optio laboriosam. Fuga qui quia numquam sint et. Sunt ut nisi rerum totam. Sunt illo sint expedita.,45346,7,2012-03-27 14:53:59 UTC,2012-03-27 14:53:59 UTC
106,Item Necessitatibus Voluptatem,Inventore ducimus dolorem. Temporibus quis ut omnis similique. Nulla vitae est. Doloremque delectus et ea rem dolore et.,90267,7,2012-03-27 14:53:59 UTC,2012-03-27 14:53:59 UTC
107,Item Blanditiis Ad,Quibusdam deleniti et. Provident et sequi. Iste reprehenderit sed optio minima.,84552,7,2012-03-27 14:53:59 UTC,2012-03-27 14:53:59 UTC
108,Item Molestiae Autem,Quod non et. Aut autem atque laborum qui tenetur consequatur eligendi. Voluptate ut corporis.,97356,7,2012-03-27 14:53:59 UTC,2012-03-27 14:53:59 UTC
109,Item Id Necessitatibus,Ab asperiores commodi fuga sed distinctio. Tempora ut neque vel. Sint soluta alias mollitia dicta quis. Dolores et omnis nulla dolore sunt.,88729,7,2012-03-27 14:53:59 UTC,2012-03-27 14:53:59 UTC
110,Item Voluptatem Consequatur,Quis quam qui distinctio. Maiores amet omnis recusandae. Sed omnis necessitatibus. Ab quasi itaque in quis quibusdam. Autem saepe molestiae vel voluptas.,8166,7,2012-03-27 14:53:59 UTC,2012-03-27 14:53:59 UTC
111,Item Nam Dolores,Voluptatibus similique aut maxime est consequatur et est. Et voluptas autem id. Nihil doloribus sed inventore laboriosam libero id. Soluta ipsum corrupti earum veniam cum voluptatem. Ut magnam consequatur quisquam dignissimos.,59164,7,2012-03-27 14:53:59 UTC,2012-03-27 14:53:59 UTC
