id,name,description,unit_price,merchant_id,created_at,updated_at
112,Item Cupiditate Amet,Consequatur et et illo accusamus veniam quos. Optio non et necessitatibus omnis fugiat quasi iusto. Neque vel nihil.,94405,7,2012-03-27 14:53:59 UTC,2012-03-27 14:53:59 UTC
113,Item Sed Beatae,Repellendus et molestias ut. Autem voluptatum temporibus itaque voluptatem non et deserunt. Et minus ullam illum mollitia. Rem aut velit.,21299,7,2012-03-27 14:53:59 UTC,2012-03-27 14:53:59 UTC
114,Item Nostrum Dolorem,Odit porro rerum cum et soluta. Odio est nam sit nobis dolores et. Eveniet incidunt dolorum.,60346,7,2012-03-27 14:53:59 UTC,2012-03-27 14:53:59 UTC
115,Item Possimus Qui,Aut deserunt dolorem accusamus expedita. Est ea qui quidem tempora natus. Error quo voluptatem eum distinctio natus consequuntur. Iste non eius totam aut.,48990,7,2012-03-27 14:53:59 UTC,2012-03-27 14:53:59 UTC
116,Item Laborum Fugiat,Quasi eum dolorum fugit consequatur. Quod ipsam earum fugit perspiciatis odio. Ut ducimus quia nihil facilis dolorum. Autem ea fuga natus aut itaque. Quidem vel sint mollitia illum dolores distinctio.,67494,7,2012-03-27 14:53:59 UTC,2012-03-27 14:53:59 UTC
117,Item Explicabo Ea,Animi rerum adipisci dolores repellat. Velit esse qui est animi. Sint quis consectetur alias eaque illum perferendis omnis. Omnis suscipit sint iure voluptate excepturi. Soluta deleniti atque dolores aliquam iusto aut.,62631,7,2012-03-27 14:53:59 UTC,2012-03-27 14:53:59 UTC
118,Item Maiores Possimus,Est natus enim. Quibusdam sint est hic debitis. Incidunt maiores fugit voluptatem. Quas consectetur exercitationem odit accusantium ab quia impedit. Ad voluptatem reprehenderit delectus.,62090,7,2012-03-27 14:53:59 UTC,2012-03-27 14:53:59 UTC
119,Item Repudiandae Corrupti,Consectetur ducimus ut sit accusamus. Adipisci hic quia est est. Omnis asperiores dignissimos ipsam perferendis similique. Expedita quae labore illum consectetur.,27717,7,2012-03-27 14:53:59 UTC,2012-03-27 14:53:59 UTC
120,Item Omnis Eaque,Doloremque non ut illum mollitia dicta in facere. Sit facilis sunt. Sed at est tenetur pariatur.,40693,7,2012-03-27 14:53:59 UTC,2012-03-27 14:53:59 UTC
121,Item Ut Quisquam,Ut explicabo cum est est sit voluptatibus eos. Nihil sunt aliquid aut enim accusamus enim quia. Mollitia in reiciendis est rerum quis cupiditate.,56608,7,2012-03-27 14:53:59 UTC,2012-03-27 14:53:59 UTC
122,Item Et Inventore,Exercitationem odit necessitatibus. Velit commodi suscipit voluptatem ut. Vero voluptatem et omnis odio sit labore. Quis in nisi omnis alias accusamus autem. Dolor doloribus rerum et.,43170,7,2012-03-27 14:53:59 UTC,2012-03-27 14:53:59 UTC
123,Item Doloribus Ducimus,Dolor ut recusandae esse. Error magni perferendis rerum incidunt numquam excepturi alias. Id modi consequatur.,37438,7,2012-03-27 14:53:59 UTC,2012-03-27 14:53:59 UTC
124,Item Asperiores Voluptas,Dolor ipsum voluptate odit quam sequi. Delectus enim occaecati voluptatem. Eum odit nisi est. Id quia maxime facere. Adipisci nesciunt harum dolor sed.,51821,7,2012-03-27 14:53:59 UTC,2012-03-27 14:53:59 UTC
125,Item Qui Ducimus,Ratione et ut natus. Aspernatur magnam odio officiis illum. Veritatis nihil dolore dolorem. Adipisci reprehenderit quaerat sint voluptatem.,65265,7,2012-03-27 14:53:59 UTC,2012-03-27 14:53:59 UTC
126,Item Dolore Hic,Veritatis voluptatem suscipit quia est qui. Et ipsam deleniti. Aut est iste facere ad.,14733,8,2012-03-27 14:53:59 UTC,2012-03-27 14:53:59 UTC
127,Item Ut Illum,Enim quae sit doloremque accusantium eaque amet quasi. Provident modi ipsum. Itaque voluptas quis non. In odio velit.,41702,8,2012-03-27 14:53:59 UTC,2012-03-27 14:53:59 UTC
128,Item Est Odio,Atque quo hic labore sed. Dolor labore aliquam. Ut et qui blanditiis corporis nulla. Libero aliquam maiores reiciendis voluptatem officiis. Recusandae vel magni repellendus.,88280,8,2012-03-27 14:53:59 UTC,2012-03-27 14:53:59 UTC
129,Item Tempore Sint,Harum ducimus temporibus enim ut delectus cupiditate voluptatum. Est rerum in ipsam. Quis praesentium doloremque et iusto labore.,64049,8,2012-03-27 14:53:59 UTC,2012-03-27 14:53:59 UTC
130,Item Commodi Vel,Sint est voluptatem impedit distinctio accusamus officia. Quam est placeat non amet. Omnis quia accusamus. Corrupti laudantium et commodi voluptate. Sed est odio molestiae itaque fugiat.,55866,8,2012-03-27 14:53:59 UTC,2012-03-27 14:53:59 UTC
131,Item Est Et,Id et et delectus. Maxime sunt architecto nemo consequatur. Expedita deleniti quibusdam dicta. Maxime repellendus optio quisquam reiciendis adipisci atque.,362,8,2012-03-27 14:53:59 UTC,2012-03-27 14:53:59 UTC
132,Item Repellendus Consequuntur,Ut aut eaque quisquam recusandae placeat deleniti. Ea quae rerum consequatur facere reiciendis nisi sed. Eum aut non optio nulla impedit qui iste. Laudantium qui iusto et modi fugit odit ut.,5760,8,2012-03-27 14:53:59 UTC,2012-03-27 14:53:59 UTC
133,Item Ut Ut,Dolores possimus eligendi officiis. Facere eveniet et vel. Neque non qui quia quaerat sapiente modi.,7159,8,2012-03-27 14:53:59 UTC,2012-03-27 14:53:59 UTC
134,Item Mollitia Ipsa,Non ad tempora. Reiciendis cum quos debitis. Et quia neque sequi dolor eligendi hic quod. Vel at velit sit expedita. Sed vel fugiat.,22546,8,2012-03-27 14:53:59 UTC,2012-03-27 14:53:59 UTC
135,Item Explicabo Iste,Neque culpa aut. Optio et sapiente ex ipsam. Sit quod vitae itaque et sunt. Natus et et aperiam est.,10653,8,2012-03-27 14:53:59 UTC,2012-03-27 14:53:59 UTC
136,Item Explicabo Harum,Ut nihil harum quia. Odio neque qui molestiae. Eligendi fugiat consequatur. Id officiis fugit et. Illo autem est qui.,11788,8,2012-03-27 14:53:59 UTC,2012-03-27 14:53:59 UTC
137,Item Nam Minus,Autem numquam sit tenetur occaecati delectus illo. Ut fugit commodi. Eligendi voluptates nihil necessitatibus temporibus. In doloribus illum nihil odio consequuntur numquam.,5440,8,2012-03-27 14:53:59 UTC,2012-03-27 14:53:59 UTC
138,Item Architecto Repellendus,Aut quam excepturi sint nobis quos accusamus. Commodi sit distinctio illo velit. Magnam laboriosam modi reiciendis voluptas. Quia enim ut expedita eos a. Est aut velit corporis voluptatem sit et et.,20670,8,2012-03-27 14:53:59 UTC,2012-03-27 14:53:59 UTC
139,Item Qui Dignissimos,Eligendi in ipsum voluptas. Alias et ut aperiam eligendi fugit est. Quod ut in. Eos consequuntur et ea dolor atque minima aut.,37587,8,2012-03-27 14:53:59 UTC,2012-03-27 14:53:59 UTC
140,Item Maxime Sed,Sunt quo harum sint corporis nobis. Et vero ad omnis est reprehenderit non consectetur. Omnis explicabo maxime. Rerum nihil veritatis et ut dicta voluptatum vero.,82370,8,2012-03-27 14:53:59 UTC,2012-03-27 14:53:59 UTC
141,Item Debitis Libero,Accusamus tempore beatae molestiae quia qui. Consequatur ad explicabo vero esse commodi. Voluptatem quod sed eaque perferendis vel veniam.,5431,8,2012-03-27 14:53:59 UTC,2012-03-27 14:53:59 UTC
142,Item Sunt Sint,Sapiente molestiae rerum. Maiores id quia. Quidem recusandae optio voluptatem et.,61282,8,2012-03-27 14:53:59 UTC,2012-03-27 14:53:59 UTC
143,Item Distinctio Laborum,Et accusantium tempore eos praesentium omnis. Fugiat cum sit nulla omnis ut adipisci quisquam. Eos sunt beatae exercitationem.,37756,8,2012-03-27 14:53:59 UTC,2012-03-27 14:53:59 UTC
144,Item Quia Nihil,Modi nisi nobis voluptatem aut distinctio. Est hic temporibus ut aut eveniet veniam voluptatum. Dolorem cumque id id sapiente maiores debitis. Perferendis non ea sequi consequuntur officiis. Fugit quibusdam asperiores ea.,13420,8,2012-03-27 14:53:59 UTC,2012-03-27 14:53:59 UTC
145,Item Et Sapiente,Distinctio facilis aspernatur ipsa aut. In voluptatibus debitis aliquid. Enim velit dolor dolores. A rerum deserunt amet et. Aperiam harum magnam non voluptate eaque assumenda voluptas.,59897,8,2012-03-27 14:53:59 UTC,2012-03-27 14:53:59 UTC
146,Item Aliquam Dolores,Magni ut quaerat laborum est voluptatum. Quia vitae qui velit ullam sit officiis et. Accusamus sequi ipsam. Optio animi voluptatibus aut a neque. Non doloremque et et est blanditiis aut rerum.,25840,8,2012-03-27 14:53:59 UTC,2012-03-27 14:53:59 UTC
147,Item Quam Qui,Assumenda placeat rerum deserunt accusamus. Modi aut necessitatibus magni nisi similique facilis occaecati. Ducimus voluptas quo nisi pariatur exercitationem soluta. Sed aliquid et nisi saepe quidem nesciunt.,46349,8,2012-03-27 14:53:59 UTC,2012-03-27 14:53:59 UTC
148,Item Error Maiores,Dolor maxime est. Error porro non cumque. Exercitationem rerum ea. Magni eum rerum. Asperiores id expedita nihil dolorem.,35848,8,2012-03-27 14:53:59 UTC,2012-03-27 14:53:59 UTC
149,Item Sit Porro,Et placeat quasi pariatur dicta quo. Totam facilis officia laborum minima dolorem est unde. Quidem impedit sint ea rem aspernatur quod. Aut similique facere odit voluptas explicabo.,33526,8,2012-03-27 14:53:59 UTC,2012-03-27 14:53:59 UTC
150,Item Illum Velit,Tenetur praesentium alias. Voluptatibus temporibus vero quasi ut et dicta repudiandae. Velit cupiditate optio ex fugiat id doloremque dolorem.,78031,8,2012-03-27 14:53:59 UTC,2012-03-27 14:53:59 UTC
151,Item Reiciendis Quo,Eos eveniet consectetur eum nihil labore. Sint esse error iste perspiciatis. Error quidem commodi perspiciatis. Ab quam maxime modi.,45849,8,2012-03-27 14:53:59 UTC,2012-03-27 14:53:59 UTC
152,Item Eos Veritatis,Id labore ea eum quos et voluptas. Ratione aut modi quo eaque vitae suscipit soluta. Ut asperiores et quia at illum molestias. Aliquid minima incidunt quibusdam blanditiis aut consequatur eum. Deleniti dolores commodi omnis maxime.,59508,8,2012-03-27 14:53:59 UTC,2012-03-27 14:53:59 UTC
153,Item Aliquam Deleniti,Nemo eligendi quidem praesentium harum nesciunt ea sint. Ut asperiores nihil enim id velit qui. Quis magnam officia quo.,96982,8,2012-03-27 14:53:59 UTC,2012-03-27 14:53:59 UTC
154,Item Distinctio Expedita,Tenetur non non totam. Est corporis totam non. Provident esse quidem aut ut ullam. Beatae tenetur non velit autem.,65464,8,2012-03-27 14:53:59 UTC,2012-03-27 14:53:59 UTC
155,Item Magni Odit,Cum ratione beatae blanditiis. Repellendus maxime cum. Quam fugiat reprehenderit quae accusamus itaque placeat eos. Incidunt ducimus blanditiis distinctio qui sunt et quo. Ipsa odio fuga.,60767,8,2012-03-27 14:53:59 UTC,2012-03-27 14:53:59 UTC
156,Item Sit Aut,Quibusdam aut est consequatur doloribus ipsa eum. Voluptas voluptas minima sint eum qui numquam. Sit numquam minima qui aut quos omnis. Sit laboriosam ullam facere accusantium est repellat. Quae quisquam qui eum quis.,71340,8,2012-03-27 14:53:59 UTC,2012-03-27 14:53:59 UTC
157,Item Maiores Quis,Incidunt maxime placeat. Officiis molestiae aut. Dolores et in excepturi in. Officia a dolorem dignissimos.,43685,8,2012-03-27 14:53:59 UTC,2012-03-27 14:53:59 UTC
158,Item Delectus Qui,Quo vel laborum sed rerum iusto sit facilis. Aut quas aut non illo exercitationem aperiam. Vel dolor dolorum itaque laboriosam distinctio ducimus.,21078,8,2012-03-27 14:53:59 UTC,2012-03-27 14:53:59 UTC
159,Item Distinctio Tempore,Consectetur quibusdam et aut optio. Recusandae aut voluptatem beatae ut hic rerum. Esse aut sed sit unde.,66503,8,2012-03-27 14:53:59 UTC,2012-03-27 14:53:59 UTC
160,Item Aperiam Qui,Et ut voluptates et aut. Qui aspernatur sequi asperiores molestias ut eos nobis. Expedita soluta dicta laboriosam iure at est odit.,7196,8,2012-03-27 14:53:59 UTC,2012-03-27 14:53:59 UTC
161,Item Animi In,Veniam vel aut doloremque eligendi est sapiente illum. Similique itaque natus et aliquam sunt. Quibusdam dicta deleniti exercitationem repudiandae in. Sequi dolorum iste vel quam sed. Quod fugiat debitis illum.,57850,8,2012-03-27 14:53:59 UTC,2012-03-27 14:53:59 UTC
162,Item Dolor Ipsa,Incidunt non quo est exercitationem quibusdam rerum voluptatem. Nemo autem et ut. Omnis voluptas repudiandae eos. Omnis inventore facere accusantium. Exercitationem vel cum.,8076,8,2012-03-27 14:53:59 UTC,2012-03-27 14:53:59 UTC
163,Item Incidunt Delectus,Molestias vero deleniti tenetur beatae id quae. Harum in doloribus. Veniam at nihil quod. Sequi debitis ad ullam reiciendis non. Sint quis sint voluptatem.,63497,8,2012-03-27 14:53:59 UTC,2012-03-27 14:53:59 UTC
164,Item Possimus Rerum,Doloremque aliquid consectetur dolorem ut nobis. In aut ea quia quia id corrupti. Dolore debitis et ut ea quia quaerat. Nihil id ut rerum quia accusamus ut qui. Est quos deserunt ipsam eum id.,90850,8,2012-03-27 14:53:59 UTC,2012-03-27 14:53:59 UTC
165,Item Et Voluptatem,Enim eos rerum temporibus distinctio quidem et debitis. Commodi iste qui. Natus laborum voluptatibus. Deleniti suscipit sunt dicta voluptates voluptatem.,61601,8,2012-03-27 14:53:59 UTC,2012-03-27 14:53:59 UTC
166,Item Ut Commodi,Eum numquam nulla libero exercitationem voluptatum. Sint dignissimos occaecati eaque similique praesentium voluptas voluptate. Qui numquam aut fugit mollitia sunt perspiciatis. Dicta laborum corrupti. Voluptatem sit excepturi omnis iure.,79569,8,2012-03-27 14:53:59 UTC,2012-03-27 14:53:59 UTC
167,Item Dicta Est,Ullam iste assumenda nesciunt aut neque. Est et expedita consectetur eos maiores perferendis aliquid. Placeat explicabo aut blanditiis culpa ipsa.,89135,9,2012-03-27 14:53:59 UTC,2012-03-27 14:53:59 UTC
168,Item Ut Perferendis,Voluptas dolorem error porro aperiam. Iure cum aut quidem nesciunt sint voluptatibus doloremque. Tenetur et iusto. Libero quibusdam expedita optio. Ad quis sit ullam error quia.,76195,9,2012-03-27 14:53:59 UTC,2012-03-27 14:53:59 UTC
169,Item Ut Sequi,Sed illum unde consequuntur molestias. Alias maiores quis odio. Ipsum officia sapiente unde enim.,71062,9,2012-03-27 14:53:59 UTC,2012-03-27 14:53:59 UTC
170,Item Cumque Nesciunt,Et vitae iste. Repellat itaque ut consequatur est dignissimos. Odio ipsum officiis. Alias velit laboriosam itaque ullam quod. Repellat ut molestiae impedit et laboriosam in.,86714,9,2012-03-27 14:53:59 UTC,2012-03-27 14:53:59 UTC
171,Item Inventore Sint,Quia consequatur similique optio voluptatibus. Iure assumenda possimus reprehenderit totam consequatur. Esse ab rerum. Eos delectus eos asperiores inventore reprehenderit a dolorem.,90994,9,2012-03-27 14:54:00 UTC,2012-03-27 14:54:00 UTC
172,Item Quo Doloribus,Id illo deleniti rem suscipit et. Nisi magni neque eos. Et qui omnis omnis sed. Nostrum repellat voluptatem voluptate qui unde incidunt molestiae.,38714,9,2012-03-27 14:54:00 UTC,2012-03-27 14:54:00 UTC
173,Item Optio Inventore,Velit quasi suscipit quas aut ipsam sapiente. Velit quo repudiandae voluptates sequi qui nesciunt et. Voluptatem velit qui provident aut saepe officia nemo. Quia fugiat perferendis hic voluptatem.,41243,9,2012-03-27 14:54:00 UTC,2012-03-27 14:54:00 UTC
174,Item Vel Fugiat,Sed nostrum totam explicabo consectetur consequatur doloribus. Esse et provident illum porro. Corporis rem ut qui laudantium quam omnis aut. Et cum a est. Excepturi nostrum aut ipsam aspernatur reiciendis magni.,47147,9,2012-03-27 14:54:00 UTC,2012-03-27 14:54:00 UTC
175,Item Magni Recusandae,Expedita doloremque earum. Provident rerum sapiente nam vero debitis quo. Assumenda autem deserunt natus itaque. Perspiciatis maiores vero voluptate.,59563,9,2012-03-27 14:54:00 UTC,2012-03-27 14:54:00 UTC
176,Item Iure Eum,Suscipit provident cum sit voluptatem voluptas iure voluptatum. Sit quae placeat. Fugit quidem dolore perspiciatis voluptatem velit. Voluptates soluta facere consequuntur voluptas similique aspernatur.,30845,9,2012-03-27 14:54:00 UTC,2012-03-27 14:54:00 UTC
177,Item Nisi Omnis,Dicta eligendi est delectus ea dolor commodi at. Quis eos molestiae dignissimos animi quam maxime aut. Est dolor eligendi est quisquam inventore. Libero unde harum enim magnam voluptatem.,40439,9,2012-03-27 14:54:00 UTC,2012-03-27 14:54:00 UTC
178,Item Distinctio Aut,Nemo occaecati illo non. Delectus vel aperiam ea. Facere ullam dolores qui. Quia vel qui consequuntur corporis rerum quia.,22442,9,2012-03-27 14:54:00 UTC,2012-03-27 14:54:00 UTC
179,Item Qui Veritatis,Totam labore quia harum dicta eum consequatur qui. Corporis inventore consequatur. Illum facilis tempora nihil placeat rerum sint est. Placeat ut aut. Eligendi perspiciatis unde eum sapiente velit.,90617,9,2012-03-27 14:54:00 UTC,2012-03-27 14:54:00 UTC
180,Item Ut Architecto,Est aperiam animi ut sequi. Et eius accusantium. Culpa sit atque provident omnis similique est. Qui eaque consequatur.,93839,9,2012-03-27 14:54:00 UTC,2012-03-27 14:54:00 UTC
181,Item Pariatur Mollitia,Officiis aut nulla. Asperiores nostrum consequuntur aspernatur libero distinctio est beatae. Est possimus maiores qui asperiores rerum ea. Dolorem voluptatem ut aliquam et ab.,21979,9,2012-03-27 14:54:00 UTC,2012-03-27 14:54:00 UTC
182,Item Recusandae Natus,Occaecati illum at non aspernatur. Enim eligendi et blanditiis consequatur. Est magni et quo odio.,13327,9,2012-03-27 14:54:00 UTC,2012-03-27 14:54:00 UTC
183,Item Eum Sed,Quos animi quia ab voluptate. Et soluta libero ea reiciendis ab eos. Ut et deleniti repudiandae.,57403,9,2012-03-27 14:54:00 UTC,2012-03-27 14:54:00 UTC
184,Item Adipisci Sunt,Earum et necessitatibus pariatur aut minus. Reiciendis sunt quo dignissimos aut. Maiores ea mollitia accusamus consequatur repellendus aspernatur. Non et dolorem fugiat tempore tempora molestias qui.,30845,9,2012-03-27 14:54:00 UTC,2012-03-27 14:54:00 UTC
185,Item Ut Similique,Voluptatem sint reprehenderit nobis libero ipsum recusandae impedit. Fugiat labore culpa. Autem est sed quia dolorem temporibus.,23175,9,2012-03-27 14:54:00 UTC,2012-03-27 14:54:00 UTC
186,Item Soluta Libero,Sit perferendis doloremque consequuntur et quisquam. Dignissimos ut magni. Animi aperiam necessitatibus eum. Earum error minus autem dolores debitis expedita et. Perferendis voluptatem itaque.,63013,9,2012-03-27 14:54:00 UTC,2012-03-27 14:54:00 UTC
187,Item Alias Repudiandae,Quas amet perspiciatis ducimus delectus id reprehenderit ea. Ipsam rem omnis rerum suscipit praesentium eum ipsum. Eos qui voluptatem aut.,47310,9,2012-03-27 14:54:00 UTC,2012-03-27 14:54:00 UTC
188,Item Optio Beatae,Exercitationem at eius. Voluptas dolorem numquam itaque earum vitae et corporis. Voluptates doloremque accusantium beatae maiores facilis similique. Rem asperiores laboriosam omnis error fuga. Officiis et blanditiis.,58459,9,2012-03-27 14:54:00 UTC,2012-03-27 14:54:00 UTC
189,Item Neque Enim,Nulla non commodi architecto sequi repellendus. Dolorum sed voluptatum. Quo omnis ex.,73258,9,2012-03-27 14:54:00 UTC,2012-03-27 14:54:00 UTC
190,Item Eaque Eos,Ea qui nulla. Doloremque aut aut aut quaerat vel in quis. Recusandae voluptate sint nesciunt vel eius.,1159,9,2012-03-27 14:54:00 UTC,2012-03-27 14:54:00 UTC
191,Item Voluptatem Quia,Id aliquam perspiciatis necessitatibus expedita impedit rerum sunt. Natus laborum eveniet qui molestias omnis. Ut aliquam optio blanditiis voluptatibus repellendus. Facilis odit inventore quo omnis in consequatur.,51285,9,2012-03-27 14:54:00 UTC,2012-03-27 14:54:00 UTC
192,Item Sapiente Est,Optio sapiente dolorem autem aspernatur. Totam maxime in dicta quis. Et enim autem hic quos nihil. Placeat nisi repellat quia cupiditate illum et distinctio.,60665,9,2012-03-27 14:54:00 UTC,2012-03-27 14:54:00 UTC
193,Item Et Alias,Qui delectus amet aut aut eum in. Quia cumque voluptas eos quod qui sapiente. Tempora iusto necessitatibus perspiciatis molestiae debitis est placeat. Quis delectus modi. Architecto eveniet aut.,98077,9,2012-03-27 14:54:00 UTC,2012-03-27 14:54:00 UTC
194,Item Cum Non,Quia iure nulla iste ad. Distinctio ex qui deserunt nihil. Consequatur nesciunt ipsa. Et esse nesciunt eos. Magnam nobis qui officiis soluta.,70506,9,2012-03-27 14:54:00 UTC,2012-03-27 14:54:00 UTC
195,Item Illum Non,Voluptatem id voluptas quibusdam aut maiores repudiandae. Rerum sed odit dolorum qui nihil. Tempora illo qui dolores est recusandae.,54969,9,2012-03-27 14:54:00 UTC,2012-03-27 14:54:00 UTC
196,Item Necessitatibus Voluptatibus,Veritatis quis at animi pariatur enim cumque cum. Rerum ut assumenda modi totam. Qui provident fugiat. Et sint possimus sit quo vel sed. Et at harum voluptates velit.,33317,9,2012-03-27 14:54:00 UTC,2012-03-27 14:54:00 UTC
197,Item Nemo Magni,Est perspiciatis blanditiis molestiae quis deserunt. Sint qui numquam sit blanditiis illo reprehenderit quis. Amet ipsam recusandae et. Nobis ut rerum animi. Enim et voluptas cupiditate non minus quasi quia.,14957,9,2012-03-27 14:54:00 UTC,2012-03-27 14:54:00 UTC
198,Item Doloribus Molestiae,Incidunt minima earum ipsam error. Ut non consequatur nesciunt eligendi ea iure aut. Alias dicta cumque ipsam dolore. In enim sunt voluptas molestias a adipisci.,76836,9,2012-03-27 14:54:00 UTC,2012-03-27 14:54:00 UTC
199,Item Ut Inventore,Rerum quas ad sit ullam est asperiores. Sapiente similique mollitia blanditiis numquam facere. Perspiciatis cum amet consequatur impedit voluptas labore.,79146,9,2012-03-27 14:54:00 UTC,2012-03-27 14:54:00 UTC
200,Item Enim Modi,Magni qui quis eius debitis necessitatibus. Perferendis incidunt dignissimos. Magni quis accusamus.,96903,9,2012-03-27 14:54:00 UTC,2012-03-27 14:54:00 UTC
201,Item Explicabo Ipsam,Est facilis sunt molestias nam praesentium aspernatur. Reiciendis tenetur culpa at repellat. Non illum nesciunt. Sed vel et odio sint. Nemo sequi minima inventore.,77409,10,2012-03-27 14:54:00 UTC,2012-03-27 14:54:00 UTC
202,Item Molestias Molestiae,Doloremque qui recusandae modi unde. Vitae consequatur commodi recusandae sunt occaecati et. Autem vel sit quos voluptatem excepturi.,81497,10,2012-03-27 14:54:00 UTC,2012-03-27 14:54:00 UTC
203,Item At Qui,Sit nemo porro dolorum quasi impedit harum. Rerum dolore libero totam laudantium sed distinctio aut. Officiis maiores non dignissimos et quae. Veritatis quo et consequatur. Quaerat nihil voluptas.,99465,10,2012-03-27 14:54:00 UTC,2012-03-27 14:54:00 UTC
204,Item Aliquam Et,Provident laudantium quis. Eveniet eos eos. Eos ea rerum laborum ex. Enim mollitia eligendi pariatur nihil non voluptatem consectetur.,21739,10,2012-03-27 14:54:00 UTC,2012-03-27 14:54:00 UTC
205,Item Ad Vel,Ea harum neque aperiam sint quos. Ipsum quia reiciendis nisi et corrupti maiores. Ea ab corporis.,98947,10,2012-03-27 14:54:00 UTC,2012-03-27 14:54:00 UTC
206,Item Laboriosam Sequi,Quasi id vel. Et non et asperiores ut tempora aut odit. Et eum porro consequatur consequatur non autem. Fugit iure porro tenetur exercitationem. Quod quos in quo ut consequatur delectus modi.,78612,10,2012-03-27 14:54:00 UTC,2012-03-27 14:54:00 UTC
207,Item Rerum Ex,Quia reprehenderit officia. Quia possimus qui velit omnis atque alias voluptatibus. Exercitationem deleniti veritatis ut. Ea ipsum eum provident rem quod pariatur. Quidem et quam enim sit id voluptatem pariatur.,32427,11,2012-03-27 14:54:00 UTC,2012-03-27 14:54:00 UTC
208,Item Eveniet Perferendis,Ullam consectetur consequatur veritatis sunt deleniti. Deleniti porro error aut. At ex cum repellat. Inventore est eum a consequatur. Nesciunt autem quia aut sit dolor quas.,48543,11,2012-03-27 14:54:00 UTC,2012-03-27 14:54:00 UTC
209,Item Nihil Et,Dignissimos tempora beatae omnis atque exercitationem vitae. Similique quis aut dolor. Et aut odit. Laboriosam reiciendis magni est fugit corrupti unde odit. Nobis ut dolorum excepturi.,23092,11,2012-03-27 14:54:00 UTC,2012-03-27 14:54:00 UTC
210,Item Aut Sit,Rerum eos sapiente repellendus cupiditate praesentium. Nulla sint quisquam corrupti autem. Sapiente unde doloremque non et sunt ipsa.,24429,12,2012-03-27 14:54:00 UTC,2012-03-27 14:54:00 UTC
211,Item Commodi Eveniet,Et exercitationem quas et expedita enim laborum. Facere incidunt illum expedita praesentium. Sequi ut labore sint in.,7737,12,2012-03-27 14:54:00 UTC,2012-03-27 14:54:00 UTC
212,Item Architecto Vitae,Rerum odit qui nostrum eveniet dicta in aut. Velit excepturi odio sapiente perspiciatis in aliquam repudiandae. Est et rerum.,2609,12,2012-03-27 14:54:00 UTC,2012-03-27 14:54:00 UTC
213,Item Iste Occaecati,Voluptates ad cum modi mollitia nihil reiciendis. Possimus est qui ut eos. Aspernatur ipsum quia delectus distinctio sed. Dolor labore veritatis.,40711,12,2012-03-27 14:54:00 UTC,2012-03-27 14:54:00 UTC
214,Item Quidem Dolorum,Laboriosam labore et minus. Et et repellendus esse fuga. Iure inventore in corrupti et aut eveniet. Molestiae repudiandae quia quo quo.,96654,12,2012-03-27 14:54:00 UTC,2012-03-27 14:54:00 UTC
215,Item Quo Soluta,Aut adipisci et consequatur rem. Suscipit ut dolor doloremque quam et laboriosam. Et ut id.,55292,12,2012-03-27 14:54:00 UTC,2012-03-27 14:54:00 UTC
216,Item Accusantium Veniam,Aspernatur nihil illum velit eaque consequatur quaerat ipsa. Velit voluptas officiis eaque minima fugit. Autem non et veritatis distinctio officia vero.,72042,12,2012-03-27 14:54:00 UTC,2012-03-27 14:54:00 UTC
217,Item Quos Voluptas,Enim velit quo quos occaecati quam corporis aspernatur. Sit delectus nisi sunt. Fugit inventore autem et labore.,60333,12,2012-03-27 14:54:00 UTC,2012-03-27 14:54:00 UTC
218,Item Voluptate Omnis,Debitis dolore mollitia quis tempore repellat molestiae soluta. Tempore minima at. Nemo magnam modi et quis amet aut. Similique adipisci aliquid tempore.,46258,12,2012-03-27 14:54:00 UTC,2012-03-27 14:54:00 UTC
219,Item Omnis Adipisci,Impedit qui non et voluptatibus itaque quos. Ullam ut quia ut blanditiis consequatur exercitationem consectetur. Sit quia expedita fuga ut.,57616,13,2012-03-27 14:54:00 UTC,2012-03-27 14:54:00 UTC
220,Item Blanditiis Molestiae,Consectetur distinctio aut sint. Tenetur dolores velit quae enim. Quisquam maxime quod deleniti aut quia accusantium.,2498,13,2012-03-27 14:54:00 UTC,2012-03-27 14:54:00 UTC
221,Item In Mollitia,Provident reprehenderit sunt laborum optio. Suscipit dolor ab ea ut et explicabo. Impedit id facere. Iusto voluptatem nesciunt ipsum veritatis iure. Hic voluptatibus nam assumenda.,72566,13,2012-03-27 14:54:00 UTC,2012-03-27 14:54:00 UTC
222,Item Exercitationem Magni,Voluptas iste enim voluptatem nobis. Qui ratione deleniti rerum reprehenderit. Consequatur ratione officiis doloribus excepturi. Nostrum occaecati et quisquam repudiandae omnis eum.,39862,13,2012-03-27 14:54:00 UTC,2012-03-27 14:54:00 UTC
